<?xml version='1.0'?>
<!DOCTYPE platform SYSTEM "https://simgrid.org/simgrid.dtd">
<platform version="4.1">

  <actor host="node-0.simgrid.org" function="app.bittorrent.Tracker">
    <argument value="3000" />
  </actor>

  <actor host="node-1.simgrid.org" function="app.bittorrent.Peer">
    <argument value="00000002"/>    <!-- my id -->
    <argument value="5000" />    <!-- end time -->
    <argument value="1" />       <!-- indicates if the app.bittorrent.Peer is a seed at the beginning of the simulation -->
  </actor>
  <actor host="node-2.simgrid.org" function="app.bittorrent.Peer">
    <argument value="00000003"/>    <!-- my id -->
    <argument value="5000" />    <!-- end time -->
  </actor>
  <actor host="node-3.simgrid.org" function="app.bittorrent.Peer">
    <argument value="00000004"/>    <!-- my id -->
    <argument value="5000" />    <!-- end time -->
  </actor>
  <actor host="node-4.simgrid.org" function="app.bittorrent.Peer">
    <argument value="00000005"/>    <!-- my id -->
    <argument value="5000" />    <!-- end time -->
    <argument value="1" />       <!-- indicates if the app.bittorrent.Peer is a seed at the beginning of the simulation -->
  </actor>
  <actor host="node-5.simgrid.org" function="app.bittorrent.Peer">
    <argument value="00000006"/>    <!-- my id -->
    <argument value="5000" />    <!-- end time -->
  </actor>
  <actor host="node-6.simgrid.org" function="app.bittorrent.Peer">
    <argument value="00000007"/>    <!-- my id -->
    <argument value="5000" />    <!-- end time -->
  </actor>
  <actor host="node-7.simgrid.org" function="app.bittorrent.Peer">
    <argument value="00000008"/>    <!-- my id -->
    <argument value="5000" />    <!-- end time -->
  </actor>
</platform>
