<?xml version='1.0'?>
<!DOCTYPE platform SYSTEM "https://simgrid.org/simgrid.dtd">
<platform version="4.1">
  <!-- The master actor (with some arguments) -->
  <actor host="Tremblay" function="sender">
    <argument value="6"/>       <!-- Number of tasks -->
    <argument value="50000000"/>  <!-- Computation size of tasks -->
    <argument value="1000000"/>      <!-- Communication size of tasks -->
    <argument value="2"/>         <!-- Number of receivers -->
    <argument value="0"/>         <!-- Use diff comm size -->
  </actor>
  <!-- The receiver processes -->
  <actor host="Fafard" function="receiver">
    <argument value="0"/>
    <argument value="3"/>       <!-- Number of tasks -->
  </actor>
  <actor host="Jupiter" function="receiver">
    <argument value="1"/>
    <argument value="3"/>       <!-- Number of tasks -->
  </actor>
</platform>
