<?xml version='1.0'?>
<!DOCTYPE platform SYSTEM "https://simgrid.org/simgrid.dtd">
<platform version="4.1">

  <actor host="node-0.simgrid.org" function="NodeActor">
    <argument value="0x0000"/>          <!-- my id -->
    <argument value ="780"/>            <!-- deadline -->
  </actor>

  <actor host="node-1.simgrid.org" function="NodeActor">
    <argument value="0x0001"/>          <!-- my id -->
    <argument value="0"/>               <!-- known id -->
    <argument value ="780"/>            <!-- deadline -->
  </actor>

  <actor host="node-2.simgrid.org" function="NodeActor">
    <argument value="0x0003"/>          <!-- my id -->
    <argument value="0x0001"/>          <!-- known id -->
    <argument value ="780"/>            <!-- deadline -->
  </actor>

  <actor host="node-3.simgrid.org" function="NodeActor">
    <argument value="0x0007"/>          <!-- my id -->
    <argument value="0x0003"/>          <!-- known id -->
    <argument value ="780"/>            <!-- deadline -->
  </actor>
  <actor host="node-4.simgrid.org" function="NodeActor">
    <argument value="0x000f"/>          <!-- my id -->
    <argument value="0x0007"/>          <!-- known id -->
    <argument value ="780"/>            <!-- deadline -->
  </actor>
  <actor host="node-5.simgrid.org" function="NodeActor">
    <argument value="0x001f"/>          <!-- my id -->
    <argument value="0x000f"/>          <!-- known id -->
    <argument value ="780"/>            <!-- deadline -->
  </actor>
  <actor host="node-6.simgrid.org" function="NodeActor">
    <argument value="0x003f"/>          <!-- my id -->
    <argument value="0x001f"/>          <!-- known id -->
    <argument value ="780"/>            <!-- deadline -->
  </actor>
  <actor host="node-7.simgrid.org" function="NodeActor">
    <argument value="0x007f"/>          <!-- my id -->
    <argument value="0x003f"/>          <!-- known id -->
    <argument value ="780"/>            <!-- deadline -->
  </actor>
  <actor host="node-8.simgrid.org" function="NodeActor">
    <argument value="0x00ff"/>          <!-- my id -->
    <argument value="0x007f"/>          <!-- known id -->
    <argument value ="780"/>            <!-- deadline -->
  </actor>
  <actor host="node-9.simgrid.org" function="NodeActor">
    <argument value="0x01ff"/>          <!-- my id -->
    <argument value="0x00ff"/>          <!-- known id -->
    <argument value ="780"/>            <!-- deadline -->
  </actor>
  <actor host="node-10.simgrid.org" function="NodeActor">
    <argument value="0x03ff"/>          <!-- my id -->
    <argument value="0x01ff"/>          <!-- known id -->
    <argument value ="780"/>            <!-- deadline -->
  </actor>
  <actor host="node-11.simgrid.org" function="NodeActor">
    <argument value="0x07ff"/>          <!-- my id -->
    <argument value="0x03ff"/>          <!-- known id -->
    <argument value ="780"/>            <!-- deadline -->
  </actor>
  <actor host="node-12.simgrid.org" function="NodeActor">
    <argument value="0x0fff"/>          <!-- my id -->
    <argument value="0x0000"/>          <!-- known id -->
    <argument value ="780"/>            <!-- deadline -->
  </actor>
</platform>
